{
  "$schema": "https://json-schema.org/draft/2020-12/schema",
  "title": "Proto UI review packet",
  "type": "object",
  "additionalProperties": false,
  "required": [
    "schemaVersion",
    "kind",
    "repositoryId",
    "pullRequest",
    "baseSha",
    "headSha",
    "reviewInputDigest",
    "observedAt",
    "reviewClass",
    "scope",
    "affectedEntities",
    "affectedSurfaces",
    "findings",
    "validation",
    "reconciliation",
    "limitations",
    "unknowns",
    "humanGates",
    "recommendedAction"
  ],
  "properties": {
    "schemaVersion": { "enum": [1, 2] },
    "kind": { "const": "proto-ui.review-packet" },
    "repositoryId": { "type": "string", "minLength": 4 },
    "pullRequest": { "type": "integer", "minimum": 1 },
    "baseSha": { "$ref": "#/$defs/sha" },
    "headSha": { "$ref": "#/$defs/sha" },
    "reviewInputDigest": { "type": "string", "pattern": "^[a-f0-9]{64}$" },
    "observedAt": { "type": "string", "format": "date-time" },
    "reviewClass": {
      "enum": [
        "review-facts-and-ci",
        "review-docs-and-links",
        "review-tests",
        "review-bounded-regression",
        "review-governed-implementation-slice",
        "review-cross-domain-semantics",
        "review-governance-and-release-evidence"
      ]
    },
    "scope": { "$ref": "#/$defs/nonEmptyStrings" },
    "affectedEntities": { "$ref": "#/$defs/strings" },
    "affectedSurfaces": { "$ref": "#/$defs/nonEmptyStrings" },
    "findings": { "type": "array", "items": { "$ref": "#/$defs/finding" } },
    "validation": { "$ref": "#/$defs/validation" },
    "agentEvidence": { "$ref": "#/$defs/agentEvidence" },
    "reconciliation": { "$ref": "#/$defs/reconciliation" },
    "limitations": { "$ref": "#/$defs/strings" },
    "unknowns": { "$ref": "#/$defs/strings" },
    "humanGates": {
      "type": "array",
      "items": {
        "enum": ["unresolved-product-direction", "privileged-or-irreversible-operation"]
      },
      "uniqueItems": true
    },
    "recommendedAction": { "enum": ["APPROVE", "REQUEST_CHANGES", "COMMENT", "ABSTAIN"] }
  },
  "allOf": [
    {
      "if": { "properties": { "schemaVersion": { "const": 2 } } },
      "then": { "required": ["agentEvidence"] },
      "else": { "not": { "required": ["agentEvidence"] } }
    }
  ],
  "$defs": {
    "publicUrl": { "type": "string", "format": "uri", "pattern": "^https://[^\\s<>]+$" },
    "agentEvidence": {
      "type": "object",
      "additionalProperties": false,
      "required": [
        "requestParaphrase",
        "source",
        "scope",
        "baseline",
        "headSha",
        "environment",
        "observedAt",
        "procedure",
        "observations",
        "visuals",
        "supportingUrls",
        "disposition",
        "debt"
      ],
      "properties": {
        "requestParaphrase": { "type": "string", "minLength": 1 },
        "source": { "type": "string", "minLength": 1 },
        "scope": { "type": "string", "minLength": 1 },
        "baseline": { "type": "string", "minLength": 1 },
        "headSha": { "$ref": "#/$defs/sha" },
        "environment": { "type": "string", "minLength": 1 },
        "observedAt": { "type": "string", "format": "date-time" },
        "procedure": { "$ref": "#/$defs/nonEmptyStrings" },
        "observations": { "$ref": "#/$defs/nonEmptyStrings" },
        "visuals": {
          "type": "array",
          "items": {
            "type": "object",
            "additionalProperties": false,
            "required": ["url", "alt", "caption"],
            "properties": {
              "url": { "$ref": "#/$defs/publicUrl" },
              "alt": { "type": "string", "minLength": 1 },
              "caption": { "type": "string", "minLength": 1 }
            }
          }
        },
        "supportingUrls": {
          "type": "array",
          "uniqueItems": true,
          "items": { "$ref": "#/$defs/publicUrl" }
        },
        "disposition": { "enum": ["complete", "partial", "blocked"] },
        "debt": {
          "type": "array",
          "items": {
            "type": "object",
            "additionalProperties": false,
            "required": ["kind", "missing", "reason", "nextAction"],
            "properties": {
              "kind": { "enum": ["publication", "verification", "outside-scope"] },
              "missing": { "type": "string", "minLength": 1 },
              "reason": { "type": "string", "minLength": 1 },
              "nextAction": { "type": "string", "minLength": 1 },
              "previewAuthorization": {
                "type": "object",
                "additionalProperties": false,
                "required": ["provider", "checkName", "authorizationUrl"],
                "properties": {
                  "provider": { "const": "vercel" },
                  "checkName": { "const": "Vercel" },
                  "authorizationUrl": {
                    "type": "string",
                    "pattern": "^https://vercel\\.com/git/authorize(?:\\?[^#]*)?(?:#.*)?$"
                  }
                }
              }
            },
            "allOf": [
              {
                "if": { "required": ["previewAuthorization"] },
                "then": { "properties": { "kind": { "const": "publication" } } }
              }
            ]
          }
        }
      },
      "allOf": [
        {
          "if": { "properties": { "disposition": { "const": "complete" } } },
          "then": { "properties": { "debt": { "maxItems": 0 } } },
          "else": { "properties": { "debt": { "minItems": 1 } } }
        }
      ]
    },
    "sha": { "type": "string", "pattern": "^[a-f0-9]{40,64}$" },
    "strings": {
      "type": "array",
      "items": { "type": "string", "minLength": 1 },
      "uniqueItems": true
    },
    "nonEmptyStrings": {
      "type": "array",
      "minItems": 1,
      "items": { "type": "string", "minLength": 1 },
      "uniqueItems": true
    },
    "finding": {
      "type": "object",
      "additionalProperties": false,
      "required": [
        "id",
        "severity",
        "confidence",
        "file",
        "line",
        "authority",
        "observed",
        "expected",
        "impact",
        "fix"
      ],
      "properties": {
        "id": { "type": "string", "minLength": 1 },
        "severity": { "enum": ["P0", "P1", "P2", "P3"] },
        "confidence": { "enum": ["high", "medium", "low"] },
        "file": { "type": "string", "minLength": 1 },
        "line": { "type": "integer", "minimum": 1 },
        "authority": { "type": "string", "minLength": 1 },
        "observed": { "type": "string", "minLength": 1 },
        "expected": { "type": "string", "minLength": 1 },
        "impact": { "type": "string", "minLength": 1 },
        "fix": { "type": "string", "minLength": 1 }
      }
    },
    "validationCommand": {
      "type": "object",
      "additionalProperties": false,
      "required": ["command", "exitCode", "result"],
      "properties": {
        "command": { "type": "string", "minLength": 1 },
        "exitCode": { "type": "integer" },
        "result": { "type": "string", "minLength": 1 }
      }
    },
    "skippedCheck": {
      "type": "object",
      "additionalProperties": false,
      "required": ["check", "reason"],
      "properties": {
        "check": { "type": "string", "minLength": 1 },
        "reason": { "type": "string", "minLength": 1 }
      }
    },
    "validation": {
      "type": "object",
      "additionalProperties": false,
      "required": ["commands", "checksNotRun"],
      "properties": {
        "commands": { "type": "array", "items": { "$ref": "#/$defs/validationCommand" } },
        "checksNotRun": { "type": "array", "items": { "$ref": "#/$defs/skippedCheck" } }
      },
      "anyOf": [
        { "properties": { "commands": { "minItems": 1 } } },
        { "properties": { "checksNotRun": { "minItems": 1 } } }
      ]
    },
    "reconciliation": {
      "type": "object",
      "additionalProperties": false,
      "required": [
        "priorReviewedHeadSha",
        "priorPacketDigest",
        "resolvedFindingIds",
        "openFindingIds",
        "newFindingIds"
      ],
      "properties": {
        "priorReviewedHeadSha": { "anyOf": [{ "$ref": "#/$defs/sha" }, { "type": "null" }] },
        "priorPacketDigest": {
          "anyOf": [{ "type": "string", "pattern": "^[a-f0-9]{64}$" }, { "type": "null" }]
        },
        "resolvedFindingIds": { "$ref": "#/$defs/strings" },
        "openFindingIds": { "$ref": "#/$defs/strings" },
        "newFindingIds": { "$ref": "#/$defs/strings" }
      },
      "allOf": [
        {
          "if": {
            "properties": { "priorPacketDigest": { "type": "null" } }
          },
          "then": {
            "properties": { "priorReviewedHeadSha": { "type": "null" } }
          }
        },
        {
          "if": {
            "properties": {
              "priorReviewedHeadSha": { "type": "string" }
            }
          },
          "then": {
            "properties": {
              "priorPacketDigest": { "type": "string", "pattern": "^[a-f0-9]{64}$" }
            }
          }
        }
      ]
    }
  }
}
